<?xml version="1.0" encoding ="utf-8"?>
<!-- planes.xml
A simple XML document for illustrating a schema The schema is in planes.xsd
-->
<planes
xmlns="http://cs.uccs.edu/planeSchema"
xmlns:xsi="http://www.w3.org/2001/XMLSchema-instance"
xsi:schemaLocation="http://cs.uccs.edu/planeSchema 
                    planes.xsd">
<make> Eeshwar </make>
<make> Lalit </make>
<make> Siddarth </make>
</planes>
<sports_car>
<make>Ferrari</make>
<model>Testarossa</model>
<engine>V12</engine>
<year>1990</year>
</sports_car>
